url,title,author,date,timestamp,text,subreddit,score,upvote ratio
https://www.reddit.com/r/Parenting/comments/zpgpp4/roblox_is_like_heroin_for_kids/,Roblox is like heroin for kids,Ava_Gras77,2022-12-19,1671420622.0,Anyone else feel like Roblox is a kid’s gateway drug? I can’t believe the negative effect this Game Center has had on my kids life! I feel like I need to send the poor kid to rehab and worry this is what I have to look forward to with drugs in the future. Does anyone have experience with Roblox withdrawal in a 9 year old?,t5_2qhn3,394,0.9
https://www.reddit.com/r/Parenting/comments/ypr4ah/alternatives_to_roblox/,Alternatives to Roblox,skysenfr,2022-11-08,1667924696.0,"Hi! So, a recent thread about 'scamming' and bad behaviour on Roblox got me thinking, do I really want my 7 year old playing this game? I already don't love the limited parental controls.

What alternatives are out there? My kid particularly likes the multiplayer ""obby's"" but I figure this thread could be a good resource for all of us looking for a better option. What do your kids like to play?",t5_2qhn3,2,1.0
https://www.reddit.com/r/Parenting/comments/whu30y/is_roblox_appropriate_for_my_9_yo/,Is Roblox appropriate for my 9 yo?,Legal_Philosophy669,2022-08-06,1659808276.0,"My 9yo has been playing Roblox on their tablet for a while and when my nephew came to visit he started talking about “inflation” where you can make the characters larger. The way he described it is almost like a fetish for plus sized people. I also just found out there is no block for the chat so anyone can pop on and say anything they want with no blocks. So, does anyone know if this game is safe for my child to use without them running into old creepy pedophiles?",t5_2qhn3,28,0.75
https://www.reddit.com/r/Parenting/comments/zwcszh/mil_bought_a_smartphone_with_sim_card_for_our_6/,MIL bought a smartphone with SIM card for our 6 yr old daughter for X mas…. I’m fuming.,Stunning-Paper-5050,2022-12-27,1672137687.0,"So my mother in law gave our 6yr daughter a smart phone with a sim and internet access. She did not discuss this with any one and gave it to her when we weren’t around on X mas day. Our daughter already has an iPad off her own to play Roblox/Minecraft and to watch cartoons on Netflix. This is tracked by an app card Lighthouse so we can monitor etc. 

When asked, she said she gave her the phone because my wife doesn’t answer hers…

I am pissed off.. there are so many dangers on the internet and associated with smart phone use. Not to mention the effect on brain development.

Am I wrong?",t5_2qhn3,1563,0.96
https://www.reddit.com/r/Parenting/comments/xzceis/need_some_nonjudgmental_advice_my_6_yo_spends_way/,Need some non-judgmental advice. My 6 y/o spends way too much time on Roblox.,jazzeriah,2022-10-09,1665289504.0,"My 6 y/o who will be 7 in December spends hours and hours of her free time either playing Roblox or watching YouTube videos of these people playing Roblox. 

She loves creating art. She’s a great reader. She’s into food and baking. Enjoys basketball. Likes activity. I hate seeing her spend so much time on this video game or on YouTube. 

I also have a 4.5 and an almost 2 y/o. I’m also the SAHD and do 95% of household tasks, etc. I have had days when we’ve done better with other activities and days when she just doesn’t want to quit Roblox. I hate how addictive this video game is.

Any advice to get her off of this?",t5_2qhn3,1,0.57
https://www.reddit.com/r/Parenting/comments/xwltyt/roblox_tiktok_etc_at_what_age/,"Roblox, TikTok, etc at what age?",Schruteschrute,2022-10-05,1665002759.0,"Hey all, we have a 9 and 5 year old and we used to let them watch YouTube and play Roblox but we got nervous about what they might be seeing and hearing / at the same time they were getting in trouble at school so we took everything away. They ask for Roblox daily and say every kid in their class has it, can anyone give a POV?",t5_2qhn3,1,0.67
https://www.reddit.com/r/Parenting/comments/vyk4xn/child_having_meltdowns_over_tablet_minecraft/,"Child having meltdowns over tablet!! (Minecraft, Roblox, etc.)",KeiyaValecourt,2022-07-14,1657763707.0,"Okay guys I desperately need advice. My son is 5 and became really interested in Minecraft and Roblox after he downloaded it a few months ago while at his grandmothers house. I’ve learned to play both of the apps with him to understand it better & see the positives. They’re fun games, I admit. My issue is every time he has to put the tablet away, he has a meltdown. Every time. The duration of these meltdowns vary but it’s stressful for us both.  Tonight I thought about just getting rid of the tablet until weekends to avoid this but I think you all may have more productive advice. How should I approach these meltdowns and tablet time? 

Things I’ve tried: 
1. Giving him 1 hour per day which he can earn more time or lose time based on behavior and activities (this is new but I’m iffy on this method) 
2. Setting a timer so he can see how much he has and giving frequent updates + Having a transition activity (which he rejects) 
3. Letting him just play all day, no limits (this did not work at all obviously) 

He is starting school next month which I hope will help naturally but for now he is home all day while I work. Any advice, tips, things I’m clearly doing wrong? Can’t put every detail in this post so ask if you need clarification on anything.",t5_2qhn3,9,0.86
https://www.reddit.com/r/Parenting/comments/10ry54s/5_year_old_girl_becoming_defiant_at_schoolmean_to/,5 year old girl becoming defiant at school/mean to friends,Bookislovakia,2023-02-02,1675365416.0,"Hey gang,

&#x200B;

Got a message from her teacher today; LO just turned 5 in January. Teacher said LO was stirring her yogurt but not eating it (not terribly surprising to me) but we do usually stir up the yogurt before eating it. Teacher assistant asked LO if she was done and LO smarted off to her. 

&#x200B;

Teacher also mentioned she hasn't been playing/speaking nicely with her friends lately. 

&#x200B;

LO has been suffering from upper respiratory stuff since forever, we had her on a medication that was supposed to help deal with the symptoms but there was some recent research out that said some kids may suffer from side effects - depressed mood, etc, so we took her off of it. We hadn't noticed TOO much but she has been defiant / rude to her grandmother, who is her usual caretaker during the week when we're working. 

&#x200B;

Her little brother recently turned 1.5, and has been a handful, so he's getting a lot of extra attention of course, because of the fact that he's a toddler. I'm sure that's playing into it. 

&#x200B;

To be 100% truthful, she gets too much screen time. YouTube - usually gaming channels and family vlogs, I haven't seen much of what she's watching that is directly objectionable - and her tablet/Roblox on the laptop.

&#x200B;

After discussing with her mom what we should do, we've decided that less screen time and some time devoted exclusively for her each day should help. Personally, I'm fine with 100% cutting her off from YouTube, and overall restricting her (and our, to be fair,) screen time down to a more reasonable level. It's hard with her little brother, but they're worth the effort. 

&#x200B;

Do you have any other suggestions to help out? Experiences?  Our overall plan is, as stated:

More dedicated one on one time for her

Less screen time overall

&#x200B;

Any other suggestions? Thank you!",t5_2qhn3,17,0.87
https://www.reddit.com/r/Parenting/comments/1057nim/should_i_make_my_12yr_old_repay/,should I make my 12yr old repay?,Any_Ad6921,2023-01-06,1673044192.0,"For background Grandma (66) has always undermined my parenting.
She is getting better about it, but it used to be really bad. She would sneak my daughter (Kylee 12) candy and treats and stuff her full of all of the junk food her little heart desires to the point it started effecting her health and anytime Kylee wanted something weather it be toys or staying up late and I told her no she could run to grandma and even though grandma knows I said no she would say yes. Sometimes when Kylee would get in trouble for misbehaving grandma would argue with me along with Kylee trying to defend her. 

I bought Kylee an iPhone for her birthday a few years back and wanted a debit card to put on file so she could down load certain apps. I told her she can't use my debit card because she is a child and I don't want any surprise charges on my phone so she goes and asks Grandma and Grandma said yes. I explained to grandma why this was a bad idea but she did not want to listen. 

  Kylee asked grandma if she could get a 10$ monthly subscription to an app using her card, I said no because grandma is on a fixed income and can't afford to pay monthly subscriptions but grandma says yes. This leads to extra charges and grandma having to call the bank and cancel her card. I tell her not to let Kylee add her card to her phone again but she doesn't listen. 

    Grandma let's Kylee add her card to her phone again although I told them both she is not allowed to do this, this time it leads to Kylee signing back up for the 10$ subscription with Grandma's permission and using grandma's card to buy Roblox also with Grandma's permission. Grandma forgets she allowed Roblox (about 50$ worth throughout the month some as a Christmas present) and didn't calculate it in her budget then comes up short on money at the end of the month and cancels her bank card gets refunded the money but has to wait for a new card. Accept for this time I make Kylee Pay back half of the money.

  Well last night not even two weeks after grandma got her new card in the mail I find out she let Kylee put her card on her iPhone again and let Kylee sign up for a free trial on her phone as long as she cancels the membership before her card is charged. Nobody said anything to me about this and now 40$ has been charged to grandma's card from apple because Kylee thinks you cancel a subscription if you delete the app she has no idea what she was doing so after the trial is up grandma gets changed for the subscription. After Kylee leaves to school grandma comes up to me and says she doesn't know how we are going to do this if she should make Kylee Pay for the whole thing or only half. But I don't know if I am going to make Kylee pay her back at all I told Grandma to stop letting my child use her bank card on her phone but she keeps giving it to her anyways what should I do?",t5_2qhn3,74,0.93
https://www.reddit.com/r/Parenting/comments/w066ot/my_son_just_got_scammed_in_jailbreak_in_roblox/,My son just got scammed in Jailbreak in Roblox,HighSpeedLowDrag0,2022-07-16,1657939700.0,"He had a bunch of limited edition cars, worth millions of dollars, and made the mistake of trading them to some scammer (a “friend” who immediately unfriended him and left the game) who promised to trade him some awesome stuff, but they ended up trading him some garbage instead. He is now crying and super upset.

Tough lesson to learn, but learning not to trust anyone is a necessity, IMO.",t5_2qhn3,7,0.73
https://www.reddit.com/r/Parenting/comments/ukohic/my_son_received_a_molesting_chat_on_roblox/,My son received a molesting chat on Roblox,ryugaiden87,2022-05-07,1651963945.0,"I’m looking for advice. My 8yo son received a text on his Roblox account saying: “I will r4pe you”. He doesn’t know who the sender is. I only let him play with his school friends and got activated all of the parental control tools inside the app. I don’t know how this happened. 

I’m looking for any advice on how do you handle Roblox or any online gaming security issues?",t5_2qhn3,6,0.67
https://www.reddit.com/r/Parenting/comments/113nma8/8_year_old_watching_twerking_videos/,8 year old Watching Twerking videos,brilex_Authority,2023-02-16,1676543730.0,"I have a soon to be 8year old son, he has his own device which he mainly uses to play some games(Roblox, Island War, Subway surfer, etc..) and watch YouTube videos (Royalty Family, Lanky Box, 🏈 Football Highlights, and what not). But I've caught him watching twerking videos, with his wee wee up and touching it. 😂😅

Now I'm his father, and I understand getting to know his body is completely normal, I'm just worried he might be starting wayyy to soon. 
I've tried putting YouTube Kids instead, but he doesn't like it, YouTube itself doesn't let me block certain content(that I'm aware of), he does have restricted time with his device, but he likes to use the device in his room or living room by himself(and he is mostly playing and watching regular things on it). 

So, idk what to do, or where to go from here...
As of now I've just told him that I understand he likes those videos but he should wait until he is older to watch them instead of now, I've used the ""those videos are for teenagers and grown ups"", and he nodded and agreed to not do it but idk what else to do. 
Has anyone deal with that? What did you do? 😅😅",t5_2qhn3,0,0.47
https://www.reddit.com/r/Parenting/comments/w6fukr/roblox/,roblox,elleapparently,2022-07-23,1658614940.0,"so my son’s (6M) father (25M) has my son primarily (for school mostly) and they live 3 hours away, i haven’t been the most active parent due to childhood trauma processing etc (honestly nobody’s business) but i’ve been more active with him lately but haven’t been able to afford interactive toys just yet. of course i’ve been taking him to the park but with this heat we haven’t stayed long. 
am i terrible for letting him play roblox for the majority of the day when we aren’t playing at the park? he is only with me for 5 days. his dad has rules and such because he has a piano and toys etc so i don’t think i’m doing too terribly as long as he’s having a good time right?",t5_2qhn3,0,0.25
https://www.reddit.com/r/Parenting/comments/w2pc6p/roblox_and_managing_kids/,Roblox and managing kids,rm21399,2022-07-19,1658226186.0,"My kids play roblox games all the time. I’m struggling to get them away from the laptop. I feel like all they do is play Roblox and are missing out on going out etc.

How do you handle laptop/game time.

How do your kids react if you stop them from playing?

Any help would be much appreciated.",t5_2qhn3,2,1.0
https://www.reddit.com/r/Parenting/comments/110h6rm/help_what_is_the_best_way_to_handle_my_m9yo_on/,HELP! What is the best way to handle my M9YO on saying sexual stuffs online,juliettesdoll,2023-02-12,1676212748.0,"Hi! Just wanted to get some advise on how to deal with my son for our upcoming talk. 

I caught him saying sexual stuffs such as “69” to his online friends and “I want to f*ck your mum” as his discord status… 

Seeing those messages has got me worried and got me curious on what led him to say such things… he likes to play games such as minecraft and roblox. He’s homeschooled-online schooling, so his friends who likes to play games has a discord server that they use to socialize and use while they’re playing… he also watches a lot of YT videos of gamers. Thinking abt those two factors has led me to assume that he might have picked up some bad content from some gamers (I sometimes overhear them saying bad words or trolling words that are inappropriate) or some of his friends might have said it. But of course, I’m not totally sure

I just want to know how is the best way I can talk to him about this as I don’t just plainly want to say that its bad or shame him about it or say that he’s young enough to understand because he does and has already an idea to it. 

Your advice is much appreciated! Thank you!",t5_2qhn3,5,0.86
https://www.reddit.com/r/Parenting/comments/10g66hs/disrespectful_8_year_old/,Disrespectful 8 year old.,ginaginapumpkineater,2023-01-19,1674146034.0,"My 8 year old kiddo has begun yelling at me. I tell her not to speak to me like that and she says ""I'm not doing anything wrong"". I'm from the south. My co-workers tell me just to pop some sense into her but I don't care for any physical discipline. I have taken away her favorite video game. She told me yesterday ""see I act the same without the video game so you should just give it back."" I need some advise. I am trying to be rational with her and telling her that her behavior is rude and horrible but she turns it back on me. Is this a phase or is this how it's going to be from now on...",t5_2qhn3,44,0.92
https://www.reddit.com/r/Parenting/comments/11d3o6u/my_mom_is_buffering_my_son_from_my_parenting/,My Mom is buffering my son from my parenting,marymoonmother,2023-02-27,1677475363.0,"Hi, I am a Mom to an 8 year old boy. My mom has work up here and has been staying with us on and off for a year. It's been just fine. I found out I'm pregnant again and I don't know if I'm just hormonal or if I need a new strategy around the both of them. 

The problem
 

I've had issues with my son on yt. He has caught bad kid videos on there and I limit that screen time to as little as possible. He has access to TV and his nintendo and toys as well. He uses the phone to play roblox. I'm fine with all that, but yt is a sore subject. For game help and certain yt creators it's fine but he drifts off onto the shorts and I'm scared he will he exposed to something inappropriate. So today after doing yt and games he went to play in his room and I told him no yt for tonight, all done. I go to check on him an hour later and he's on yt. Watching something weird. I tell him he was told no, start to go into him going behind my back when my mom comes in and starts a whole rant cutting me off about how there can be bad videos on there and it's not his fault if those come on and yadda yadda yadda. 

I feel really annoyed and shut down by her about my own kid. I tell him no phone tonight n tell him he will have limited time tomorrow because he disobeyed and leave the room. She's in there extra long probably cuddling him about big bag mom.

She comes out into the living room and I tell her without him hearing that I dont appreciate her going off topic when I'm talking to my son about disobeying.

She tells me that if I want him to obey I have to explain it to him why there are dangers. I tell her I already have many, many times before and right then wasn't about the dangers of yt it was about being told no and then doing it anyway. She then remarks that I must not know he's only 8. Oh it pissed me off. I don't say anything and just calm down and then after a few minutes I go into his room and I talk to him about some things are fun on yt, but he needs to watch that in the room with an adult. Screen time is fine but when his time is up on it it's up and to do that behind my back makes me disappointed.  He understands and we hug it out. End of topic.

I go back out in the living room and tell her sorry and tell her I explained to him n she still acts all mad.

AITA? I feel like I might be. But she's also done this before. Sometimes, not every time I scold my kid or correct him she jumps in and tries to change the subject and talk to him about something else. 

I feel like its really rude. He's my kid to parent. I don't spank him, I don't yell, we talk about what he did wrong, why and either clean it up together or if it's really bad a time out. It's rare because he's a really good kid and usually nothing beyond ""hey let's not do that"" is all it takes. Just sometimes something like a breaking of trust is something I want to talk more about. I feel like she acts like she has to jump in or explain to him why I'm scolding him and it's really unneeded. We always talk about it. Either right away or a minute to cool down then talk. 

Am I just being too dramatic about this? Have you dealt with this? I don't want to be rude to her, but it is my house and I have a very good kid because I do parent him well. His father does live here too but is always working or doing his own thing. He's taken on double shifts and does what he wants on his time off. So majority of the parenting is me. I'm mom and dad to our son. Which means nurture and the talking to if needed. To me It feels like my mom is trying to take over the nurturing side entirely and leave me no room to do that n I'm stuck with the discipline side. Making me the bad guy constantly. And cuddling him after I speak to him. 

I'm not the best at being both parents. That's true. But I feel like I should be able to talk to my own kid without her buffering everything I say to him. 

Idk. If I'm being dramatic just please let me know. I tried to be as neutral explaining this as possible but I'm clearly biased to my own side. So take that with what you will.",t5_2qhn3,0,0.33
https://www.reddit.com/r/Parenting/comments/w5tmuf/opinions_on_8_year_old_playing_roblox_for_fun/,Opinions on 8 year old playing roblox for fun?,Valuable-Builder-459,2022-07-23,1658546985.0,Husband and I were talking and our almost 8 year old who has autism and loves roblox.. He's always hated him playing roblox but it's just something he loves to do after school and during the summer. I don't think it's a big deal and I think it'll phase out and I do think the autism plays part in him obsessing over the game. We agree he needs to kind of play other things and just branch out besides roblox. During the school year he only plays his tablet 5PM-7PM an gets an hour tv. There are times when he studies and does chores so that's why I just don't mind him playing roblox and doing something he thinks fun during his couple hours of tablet time. Hubby was just saying how roblox is just mind numbing but I feel like that's just any game. Games are just an escape and just to relax. Am I wrong for disagreeing about letting our 8 year old play roblox just for fun?,t5_2qhn3,4,0.83
