url,title,author,date,timestamp,text,subreddit,score,upvote ratio
https://www.reddit.com/r/Parenting/comments/1016qo0/my_husband_thinks_our_daughter_is_terrified_of_me/,My husband thinks our daughter is terrified of me. I've never laid a hand on her...,Kittenknickers333,2023-01-02,1672645220.0,"We have a 5yo little girl with ADHD. She is not medicated. My husband travels for work so I'm left to parent alone 5 days out of the week, sometimes 6. That means I do all the fighting about homework, tooth brushing, bed time and so on. All alone. So far, the consequences of my husband's work has been that I am the bad cop and he the good. He comes in on Friday night with a patience cup full to the brim and therefore, very rarely runs out of patience when it comes to our daughters defiant behavior and big emotions. 

I deal with them as best I can, but obviously, I'm more worn down. Yes, I lose patience and get snippy. I have a tone of voice my daughter calls ""yelling"" and she gets upset when I use it. No I do not raise my voice unless she's across the house and can't hear me. 

Tonight was a Sunday on winter break so we spent the day in just playing games and relaxing. As per usual, my daughter asked me to play roblox with her. I said yes. 

As bed time ran nearer, my daughter began to get upset because I wasn't playing right. This is standard for when we play together. She's extremely controlling and also a sore loser, so if she's not blaming me for making her lose, she's mad at me for not playing like how she wants. When she started getting upset, I told her if she couldn't calm down we would have to stop playing. This is a regular consequence for when she starts having a tantrum. This made her upset and she ran to cry in the hallway. 

My experience with her told me to just leave her alone to work it out by herself. She's doing what I told her to do, calming down. If I try to talk to her while she's in this state, it tends to trigger an even larger tantrum. 

My husband came out of the bathroom and discovered her there. He asked her what was wrong and she told him. We were playing a game and she wanted me to play a certain way and I told her no, I play my way with my computer and she has my laptop to play her own way. We were still in the same game, still playing together, just different ways. My husband tried explaining that to her and she started screaming at the top of her lungs. That's when I decided it was bed time, we will not play if she's going to throw a fit. 

As always, my husband thinks he can handle it so he tells me to feed the dog while he talks to her. I go. When I come back, he has her tucked in bed and very angerly tells me we have to talk about ""how I deal with things"" 

At first he tells me that I have to control myself and not get angry because our daughter is upset. I told him I didn't feel angry because she was upset, i was frustrated. I didn't yell, but I did have a tone when I told her it was bedtime. 

I feel like it's pretty normal to be frustrated when a child is throwing a fit, my husband thinks it's abusive. 

He then told me that she said she was hungry. He told her he'd get her some food, and she said no because I'd be mad at her. The reason she said this is because the rule is no eating after brushing your teeth. We always have to fight her so hard most nights that it's not worth it to have her do it again. My husband came up with this rule himself but since he's not here 70% of the the time, I am the enforcer of that rule, and all rules. She had brushed her teeth and she knew I wouldn't approve of the food. 

I thought this was a normal child worry. No kid wants their parents to be mad. But my husband took this as evidence that my daughter who has never been screamed at or spanked or even slapped on the wrist, is terrified of me. I don't even give this kid time outs anymore! Not since she was 3 and we started suspecting her Adhd! I stick strictly to consequences. She would not have gotten in trouble for eating but yes, I'd get annoyed and make her brush her teeth again. 

I'm so hurt by what my husband said. He thinks that I shouldn't give her any consequences for getting angry at the games either. I should just let her feel her feeling and continue on like nothing happened, even if she screams at me, even if she knocks things off tables and rips up papers. I am to let her do it and because anger is a valid emotion. 

I'm floored, to say the least. I don't even know what to say. I'm here to get some validation that I'm not insane and that I'm not causing trauma to my daughter.",t5_2qhn3,30,0.88
https://www.reddit.com/r/Parenting/comments/11acd7t/i_need_advice/,I need advice,Nikkieking712,2023-02-23,1677195332.0,"My daughter is 9, she is going through puberty, she has adhd, and is on medication. We have a DRs appointment to speak with her dr about hormone changes and the effect her medication has on that, 
Recently within the last 3 weeks, she has been challenging every no she hears or when we ask her to do her chores , (she has whined in the past but usually was understanding as to why we said no because we do explain why we are saying no) she will argue scream cry hit the walls throw things etc. she doesn’t have ODD I have spoken to my therapist about it, 
My therapist has told me to give her one task to do at a time, she doesn’t have a whole lot chores. Put dishes away and load dish washer, keep room clean, put laundry away (I don’t even make her fold her clothing, just keep it organized.) this is a HUGE problem for her, it took her 6 days to complete this task, I then found clothing shoved under the bed behind dresser etc. I’ve explained to her that doing this makes it more difficult then just doing the original task. Her issue is that we make her do the chores (because her friend don’t have to do chores) and she can’t have her cell phone during the week( we make her earn it because nothing is free in the world and we’re trying to teach her this and to be a functional adult when the time comes, she also has restrictions on the phone, no YouTube, no Roblox nothing that is social media based I’m trying to keep her safe but also allow her to talk to her friends that we don’t live around anymore due to being a military family.) 

Does anyone have any advice on how to get through these trying times with her and help her while keeping my boundaries for my peace as well as hers?",t5_2qhn3,0,0.5
