url,author,date,timestamp,score,comment,comment_id,parent_id
https://www.reddit.com/r/RobloxParents/comments/yvjs1c/can_you_limit_friends/,zackyattacky,2022-11-15,1668479314.0,1,You unfortunately can't limit friends or turn off friend request. Best you can do is tell her not to add anyone she doesn't know and keep it to friends only. If she follows that rule you can make it so that only friends can message her and chat with her on the website. As far as in-game chat goes that's either all or nothing I think. Fortunately there's the increased chat filter for accounts under 13. You can set the experiences she's able to play to be suitable for all ages so she can't join the 9+ and 13+ reccomend games and hopefully she doesn't run into any weirdos which honestly is pretty rare unless you're joining weird games. Of course always monitor your kids online and teach them internet safety so they can make smart on their own as well. Teach them how to block anyone being mean by clicking their name on the leaderboardsand clicking the Block button and also make sure their settings are set so that only their friends can follow them into games.,iwery2p,N/A
https://www.reddit.com/r/RobloxParents/comments/yvjs1c/can_you_limit_friends/,discovoytng,2022-11-15,1668489219.0,2,Thank you!!,iwfc4d5,iwery2p
https://www.reddit.com/r/RobloxParents/comments/yvjs1c/can_you_limit_friends/,JesseB999,2022-11-15,1668479809.0,1,"It's a terrible platform for little kids. No matter the age recommended games, if you monitor them long enough, some creep (often an older kid, far as I can tell) finds a way to get around the (lame) attempts to keep things child-friendly. Reporting them does nothing. And don't bother ever calling customer support on an issue...it's a joke. 

Good job restricting her chat ability, but that is half the reason many of them play. Good luck!",iwet3lq,iwery2p
https://www.reddit.com/r/RobloxParents/comments/v4lgzq/beast_mode/,StateApprehensive851,2022-06-18,1655579920.0,1,Can i offer Candy Set and logchopper?,icv36ci,N/A
https://www.reddit.com/r/RobloxParents/comments/tz00mx/lf_account/,monster0amongst,2022-04-15,1650064985.0,1,i have a acc im willing to sell with headless korblox a few thousand robux and so i just need proof you are going to give me money i need 100 dollars or 50 at best and no this isn't a scam.,i4w67n1,N/A
https://www.reddit.com/r/RobloxParents/comments/tz00mx/lf_account/,monster0amongst,2022-04-15,1650065023.0,1,"Istg im legit, like im being so serious rn. I need to sell my acc!",i4w6ah9,i4w67n1
https://www.reddit.com/r/RobloxParents/comments/tz00mx/lf_account/,Ieat_Toess,2022-05-06,1651818995.0,1,im so sorry! but im only trading my acct w poisonous beast mode atm,i7iwzs4,i4w67n1
https://www.reddit.com/r/RobloxParents/comments/tz00mx/lf_account/,monster0amongst,2022-05-15,1652573967.0,1,i have that too!,i8n0amp,i7iwzs4
https://www.reddit.com/r/RobloxParents/comments/tz00mx/lf_account/,monster0amongst,2022-05-15,1652574128.0,1,did you find a acc yet? im selling for only 20 and i have 200k on this account i can give you the username and password for free even if you want :),i8n0lv8,i8n0amp
https://www.reddit.com/r/RobloxParents/comments/tk4irw/i_really_dont_like_this_game/,JumpOutWithMe,2022-03-22,1647989849.0,2,"Definitely not for 4-year-olds. I hope, at the very least, chat is not enabled. There is a lot of random violence. The best option is for them to only join a private server (which are free and easy to set up with a couple of clicks for any game) that includes only just the kids in the daycare.",i1q3mix,N/A
https://www.reddit.com/r/RobloxParents/comments/tk4irw/i_really_dont_like_this_game/,Altoid24,2022-04-11,1649716154.0,1,"That's not, by any means, what most people do, correction, what anyone does on that game, other then that specific instance, when they arent allowed to play the game. That incident wasn't just because of that, there was many more factors. While what occurred is extremely unfortunate, roblox isn't the primary issue that lead up to that event, not by a long shot.",i4copak,N/A
https://www.reddit.com/r/RobloxParents/comments/s2devg/account_restrictions_and_chat/,wallyg1974,2022-08-05,1659658850.0,2,"I came here looking for this among other things, but the lack of response \*in 7 months\* seems to indicate that a) this subreddit does not have anyone at all knowledgeable on this, and b) it's actually full of just scared/ignorant parents...

Oh well, will have to keep looking elsewhere.",iizn2tr,N/A
https://www.reddit.com/r/RobloxParents/comments/rebgpt/idk/,crxmsy,2022-01-15,1642239629.0,1,"poisionous beast mode ( was worth 10 robux ) is not tradeable so it is not worth anything, and meta valk is a free item.",hsqx56k,N/A
https://www.reddit.com/r/RobloxParents/comments/qkk1tx/is_anyones_kid_playing_funeral_games_on_roblox/,scorpycoby,2023-02-01,1675225523.0,1,Why do kids do that 😳,j6qjljn,N/A
https://www.reddit.com/r/RobloxParents/comments/q3dwxc/adult_video/,Geeluxe,2021-10-08,1633709373.0,1,"I don’t really understand what happened, the video played on Roblox? Video media hasn’t really built into Roblox save for a select few clips, any chance you could link the game?",hfvacen,N/A
https://www.reddit.com/r/RobloxParents/comments/q3dwxc/adult_video/,clisske,2021-10-10,1633831683.0,1,"It was like a clip before the game opened (after you click the play button)- although I didn’t wait to see if the game did start because I closed out of it quickly.  A few minutes later I tried the same game again and it was functioning like normal. 

 I don’t know how I could link the game?",hg1zq1z,hfvacen
https://www.reddit.com/r/RobloxParents/comments/q3dwxc/adult_video/,clisske,2021-10-10,1633831868.0,1,It was actually “Don’t press the button 3”,hg202xr,hfvacen
https://www.reddit.com/r/RobloxParents/comments/lnkqj5/account_hacked_and_roblox_saw_nothing/,georgiana_xox,2021-06-01,1622512589.0,1,How long did it take to retain access to the roblox account?,h05b1qh,N/A
https://www.reddit.com/r/RobloxParents/comments/lnkqj5/account_hacked_and_roblox_saw_nothing/,Mixel01,2021-06-01,1622513549.0,1,"A day or two if I remember correctly. They changed the email address on the account back to the original so that we could get the password reset. They wouldn’t refund any of the robux spent though, even though their policy says they offer a one time account “restore”.",h05cupx,h05b1qh
https://www.reddit.com/r/RobloxParents/comments/lnkqj5/account_hacked_and_roblox_saw_nothing/,georgiana_xox,2021-06-01,1622513580.0,1,Okay thank you!,h05cwru,h05cupx
https://i.redd.it/78x7a1m926d61.jpg,zackyattacky,2021-01-24,1611454013.0,2,Try hitting tab. Should put it away in most games if they're using the default leaderboard.,gkhcj9x,N/A
https://i.redd.it/78x7a1m926d61.jpg,scorpycoby,2023-02-01,1675225716.0,1,Click menu icon→leaderboard,j6qjyq4,N/A
https://www.reddit.com/r/RobloxParents/comments/gtj5jw/time_spent_on_roblox/,bro2jdl,2020-06-06,1591450734.0,2,"Not a parent but I do play roblox often and there isnt really a way to check how much time but if you have a computer you can see how much time she spends by looking at browser history or setting up a thing where it tracks time, on a phone and ipad you can set up time limits.",ft4cqt6,N/A
https://www.reddit.com/r/RobloxParents/comments/gtj5jw/time_spent_on_roblox/,Deathly_banana,2020-06-11,1591900620.0,1,Roblox more like mom give me more robux got em,ftq0j4s,N/A
https://www.reddit.com/r/RobloxParents/comments/gtj5jw/time_spent_on_roblox/,xornotxor,2020-08-23,1598192017.0,1,"Faced the same issue , now using Microsoft parenting to limit time, and encouraging other activities. Microsoft parenting will display the amount of hours spent on each app.",g2l2lzd,N/A
https://www.reddit.com/r/RobloxParents/comments/gtj5jw/time_spent_on_roblox/,motif04,2020-06-08,1591635240.0,2,Thanks! I was hoping to avoid those options (another thing to sign up for!) But looks like that's the only option.,ftdvk4d,ft4cqt6
https://www.reddit.com/r/RobloxParents/comments/gskexv/question_about_chat_features/,derfad,2020-05-29,1590735104.0,1,do the settings described [here](https://en.help.roblox.com/hc/en-us/articles/360031751471) help?,fs6chgp,N/A
https://www.reddit.com/r/RobloxParents/comments/gcz5gx/is_there_a_page_that_shows_you_what_games_your/,zackyattacky,2020-05-04,1588555489.0,2,"Yes there is. Click the Roblox logo in the top left to go to the homepage. From there you can see a section of games called ""Recently Played"" or ""Continue Playing."" Click on the header and it'll bring you to a page with even more recently played games. The list doesn't go on forever but it'll show a lot of the most recent games.",fpeuy6k,N/A
https://www.reddit.com/r/RobloxParents/comments/gcz5gx/is_there_a_page_that_shows_you_what_games_your/,zackyattacky,2020-05-04,1588563728.0,1,"Was looking at the mobile sight when I made this comment but it's basically the same on the computer. Go to the Roblox homepage and right below friends is the Continue Playing section. Hit ""See All"" above the continue playing section to see all of their recently played games.",fpf7lug,fpeuy6k
https://www.reddit.com/r/RobloxParents/comments/gb8pc8/how_much_have_you_spent_total_on_robux_for_your/,Rbfoges,2020-09-16,1600224506.0,1,Too much!,g5flns5,N/A
https://www.reddit.com/r/RobloxParents/comments/gb8pc8/how_much_have_you_spent_total_on_robux_for_your/,scorpycoby,2023-02-01,1675226162.0,1,Enough that if I didn't spend it on robux I would be able to afford a vacation🙄,j6qksiq,N/A
https://www.reddit.com/r/RobloxParents/comments/gb5qmd/make_your_kids_do_chores_for_robux/,evanultra01,2020-06-21,1592717752.0,1,"Robux is worthless tho.

THATS THE POINT.

Your kid thinks your getting him a gold mine even though its a piece of string",fvihjmb,N/A
https://www.reddit.com/r/RobloxParents/comments/g9wobp/do_you_or_do_you_not_disable_chat_for_your_kids/,MinimumComfortable,2020-04-28,1588111515.0,3,"I know some parents disable the chat. Personally, I don't disable it since I think by reading and typing chat messages it improves social, grammar and spelling skills. I do monitoring sometime and otherwise I think the chat filters are pretty good.",fow1xyw,N/A
https://www.reddit.com/r/RobloxParents/comments/g9wobp/do_you_or_do_you_not_disable_chat_for_your_kids/,TheAgarioGuy,2020-05-01,1588353410.0,1,"I would disable them personally. Alot of robloxians bypass the filter, and others rage. But, you can do whatever you want as long as your child enjoys roblox. The only reason I would keep it on is so he/she can chat to their friends on roblox.",fp6jiai,fow1xyw
https://www.reddit.com/r/RobloxParents/comments/g9tqii/best_educational_games_in_roblox/,scorpycoby,2023-02-01,1675226308.0,1,It got so bad that I recommend jenga,j6ql2jy,N/A
https://www.websafety.com/2018/07/the-hidden-dangers-of-roblox-every-parent-should-know-about/,FPMFP-,2020-04-29,1588181093.0,1,Yeah make sure your always making sure your child on the internet.,foyxnma,N/A
https://www.reddit.com/r/RobloxParents/comments/g9rtr4/best_roblox_game_for_4_year_old/,KiwiBananaz,2020-09-07,1599450332.0,2,"none, tbh that seems waaaayy too young",g4arou0,N/A
https://www.reddit.com/r/RobloxParents/comments/g9kw8a/what_kind_of_parental_controls_are_available_in/,DiscustingDegenerate,2020-04-28,1588076579.0,1,"you can disable chat,make chat more restrictive, who can join your games,who can chat in site,and restrict the account so it can only play games roblox has reviewed",fou5atl,N/A
https://www.reddit.com/r/RobloxParents/comments/g9kw40/how_do_you_prevent_your_child_from_playing_games/,DiscustingDegenerate,2020-04-28,1588076647.0,1,turn account restrictions on (its is automatically on and can't be turned off if the age you put when making a account is lower than 13),fou5e3u,N/A
https://www.reddit.com/r/RobloxParents/comments/g9kvlg/how_much_do_you_spend_on_robux_per_week_for_your/,Cookiesrdelishus,2020-04-29,1588152651.0,1,"Alright I'm not a parent, yet.  
I am currently a college student. Just to clarify before I answer.  


I probably spend 10$ worth of robux every two to three months. Since all I pretty much spend it on are clothing and avatar customization, 800 robux is plenty to spend in 3 months.",foxqflq,N/A
https://www.reddit.com/r/RobloxParents/comments/g9kvlg/how_much_do_you_spend_on_robux_per_week_for_your/,scorpycoby,2023-02-01,1675226371.0,1,Week? none,j6ql6yi,N/A
https://www.reddit.com/r/RobloxParents/comments/g9kqr2/how_long_has_your_kid_been_playing_roblox/,StupidSam1,2020-05-03,1588465500.0,1,I’m not a parent but myself have been playing roblox since 2014 (6 years),fpbaal6,N/A
https://www.reddit.com/r/RobloxParents/comments/g9kq3j/welcoming_all_parents_to_the_rrobloxparents/,ZakBokk,2020-04-28,1588113289.0,2,Am happy to be a new member of the Roblox Parent Community! My 5 year old just started playing Roblox today and am sure I will have many questions!,fow5bhm,N/A
https://www.reddit.com/r/RobloxParents/comments/g9kq3j/welcoming_all_parents_to_the_rrobloxparents/,MinimumComfortable,2020-04-28,1588114066.0,2,Welcome to the community! all of us here are parents with kids playing and we will be happy to help with any questions! The community here is very helpful!,fow6s8w,fow5bhm
https://www.reddit.com/r/RobloxParents/comments/w2hwxf/pbm_4_korblox/,uabdhc,2022-07-31,1659293056.0,1,"yeah! ik im not who ur talking ab but i got an acc with purple beast mode and im more than willing to trade with you and negotiate, I already added ur cord since it was linked to ur roblox acc, lol my user is uab so just add me back and i can send proof of ownership n shit.",iievx2h,N/A
https://www.reddit.com/r/RobloxParents/comments/w2hwxf/pbm_4_korblox/,digitaldahoodian,2022-08-24,1661377418.0,1,whats ur kord,ilngf4u,N/A
https://www.reddit.com/r/RobloxParents/comments/w2hwxf/pbm_4_korblox/,Total-Affect-2532,2022-08-09,1660067055.0,1,add my discord casino#6666,ijlw2zr,iievx2h
https://www.reddit.com/r/RobloxParents/comments/w2hwxf/pbm_4_korblox/,Total-Affect-2532,2022-08-25,1661470760.0,1,its have#1111,ilsw9xj,ilngf4u
https://i.redd.it/lcjr26a7isx81.png,Ieat_Toess,2022-05-06,1651816409.0,1,https://www.reddit.com/r/RobloxParents/comments/ujg6jn/trading\_account\_with\_poisonous\_beast\_mode/?utm\_source=share&utm\_medium=web2x&context=3,i7itlp0,N/A
https://i.redd.it/lcjr26a7isx81.png,Alone-Contribution-9,2022-05-19,1652997810.0,1,"Can we trade accounts, my account has robux in it, and it has a rare username: 3_37m",i997cf9,N/A
https://i.redd.it/lcjr26a7isx81.png,AwkwardPollution6611,2022-05-24,1653362878.0,1,i'll pay you bro,i9rllag,N/A
https://www.reddit.com/r/RobloxParents/comments/gag26x/is_there_an_age_that_is_too_young_for_roblox/,0_Dancing_Llama_0,2020-04-29,1588204062.0,3,Depends what games are being played,fp07r2e,N/A
https://www.reddit.com/r/RobloxParents/comments/gag26x/is_there_an_age_that_is_too_young_for_roblox/,JollyMingtingTDM,2020-05-07,1588850981.0,1,First person shooters like arsenal I reccomend for like 12 yew ars,fprdei1,N/A
https://www.reddit.com/r/RobloxParents/comments/gag26x/is_there_an_age_that_is_too_young_for_roblox/,Blaziers,2020-05-17,1589740530.0,1,"It’s a game for all ages. However, realistically I’d recommend 12+, but that’s just my opinion.",fqy09n9,N/A
https://www.reddit.com/r/RobloxParents/comments/gag26x/is_there_an_age_that_is_too_young_for_roblox/,KiwiBananaz,2020-09-07,1599450214.0,1,less than 10-11 seems too young,g4arir0,N/A
https://www.reddit.com/r/RobloxParents/comments/ga2z1l/why_are_robux_so_expensive_my_son_already_is/,Geeluxe,2020-04-29,1588167245.0,2,"Hey Z, just joined this Sub to alleviate any questions you guys might have. 

Roblox monetized it's in-game currency in an effort to rope-in hardcore game or content developers to their game, most of the time when you see a really well made game it was made by a team of developers not for the purpose of hobbies, but because they are getting paid! Any Robux gained from their content can be traded in for cash.This is why Robux is so expensive to buy in the first place.",foy7t0p,N/A
https://www.reddit.com/r/RobloxParents/comments/ga2z1l/why_are_robux_so_expensive_my_son_already_is/,Ihaveyes69420,2020-04-29,1588169846.0,2,"It might be best to monitor your son, if he really wants robux he might go to the links to websites that bypass the Roblox filter. These are phishing sites, its best to set up an email and account pin which can be found in settings. If he clicks one of the phishing links go to Roblox settings, security and log out of all other sessions. It would also help to teach him about scams.",foyc8v5,N/A
https://www.reddit.com/r/RobloxParents/comments/ga2z1l/why_are_robux_so_expensive_my_son_already_is/,StupidSam1,2020-05-04,1588605246.0,2,"Well, Roblox Corp. Needs to make money somehow? And also 10,000 robux is around 100 USD.

You can get a few hundred for around 5 USD, that'll be a good sum for starters.",fpglwm7,N/A
https://www.reddit.com/r/RobloxParents/comments/ga2z1l/why_are_robux_so_expensive_my_son_already_is/,FPMFP-,2020-04-29,1588178709.0,1,Make sure you don't spend 100 dollars on robluxes its not worth it trust me it will go by in an instant. I learned that the hard way.,foyt682,N/A
https://www.reddit.com/r/RobloxParents/comments/ga2z1l/why_are_robux_so_expensive_my_son_already_is/,Afimiliarface,2020-07-01,1593626667.0,1,"Well your son has to learn.
Al, he needs is a few hundred man. 
You shouldn’t spend so much at a time, you know?",fwluvmg,N/A
https://www.reddit.com/r/RobloxParents/comments/ga2z1l/why_are_robux_so_expensive_my_son_already_is/,Virtual-War-9839,2022-05-01,1651434425.0,1,lol,i6xxk5h,N/A
https://www.reddit.com/r/RobloxParents/comments/ga2z1l/why_are_robux_so_expensive_my_son_already_is/,Beluga_Cat3000,2022-06-05,1654390002.0,1,bobux,ib7afay,N/A
https://www.reddit.com/r/RobloxParents/comments/ga2z1l/why_are_robux_so_expensive_my_son_already_is/,NickskiSeagull1959,2022-11-07,1667847754.0,1,"It is understandable that developers should be paid for creating games, if they are good games with a good following, but many things are so expensive that greed has obviously taken over. Developers should not be paid for bad games or games that do not work properly.",ivg6j5o,N/A
https://www.reddit.com/r/RobloxParents/comments/g9zqrk/where_can_i_buy_a_roblox_gift_card_for_my_sons/,Cookiesrdelishus,2020-04-29,1588151823.0,2,You can buy one online and just get a redeemable code via email,foxpmcn,N/A
https://www.reddit.com/r/RobloxParents/comments/g9zqrk/where_can_i_buy_a_roblox_gift_card_for_my_sons/,MinimumComfortable,2020-04-29,1588122031.0,1,I checked CVS and target but they didn't have one. I know GameStop and best buy have those but they are closed,fowlbon,N/A
https://www.reddit.com/r/RobloxParents/comments/g9zqrk/where_can_i_buy_a_roblox_gift_card_for_my_sons/,derfad,2020-04-29,1588138602.0,1,Maybe you could buy a Google Play card if its on mobile I think they have those in more locations and you can also use them for Robux,foxaw5z,N/A
https://www.reddit.com/r/RobloxParents/comments/g9zqrk/where_can_i_buy_a_roblox_gift_card_for_my_sons/,scorpycoby,2023-02-01,1675226266.0,1,Practically everywhere,j6qkzpw,N/A
https://www.reddit.com/r/RobloxParents/comments/g9zqrk/where_can_i_buy_a_roblox_gift_card_for_my_sons/,ackermanacks,2020-04-29,1588137863.0,1,"Hmm, have you check your local Walmart?",fox9yk7,fowlbon
https://www.reddit.com/r/RobloxParents/comments/g9zqrk/where_can_i_buy_a_roblox_gift_card_for_my_sons/,MinimumComfortable,2020-04-29,1588138501.0,1,No Walmart close to my location,foxarm7,fox9yk7
https://www.reddit.com/r/RobloxParents/comments/g9zqrk/where_can_i_buy_a_roblox_gift_card_for_my_sons/,ackermanacks,2020-04-29,1588138616.0,1,Well oof im out of ideas,foxawtv,foxarm7
https://www.reddit.com/r/RobloxParents/comments/g9zqbc/at_what_age_would_a_kid_be_able_to_learn_to/,FPMFP-,2020-04-29,1588180855.0,1,I started at 9. Also if he would like to get into roblox scripting he should definitely check out alvinblox.,foyx7b8,N/A
https://www.reddit.com/r/RobloxParents/comments/g9zqbc/at_what_age_would_a_kid_be_able_to_learn_to/,zackyattacky,2020-05-02,1588394419.0,1,I was 10 when I started messing around in Roblox studio. With Roblox being as big as it is now I'm sure there's YouTube videos that could help out even younger kids.,fp8k4dk,N/A
https://www.reddit.com/r/RobloxParents/comments/g9zqbc/at_what_age_would_a_kid_be_able_to_learn_to/,cgb33,2020-05-03,1588517302.0,1,My son started at 9,fpd0ozw,N/A
https://www.reddit.com/r/RobloxParents/comments/g9lc6n/is_mobile_or_desktop_better_to_introduce_child_to/,MinimumComfortable,2020-04-28,1588102828.0,1,"I think it depends on the age and what they are comfortable with. My son started playing Roblox when he was 4 years old on the phone, then switched to PC around 5 year old",fovkg5i,N/A
https://www.reddit.com/r/RobloxParents/comments/g9lc6n/is_mobile_or_desktop_better_to_introduce_child_to/,FPMFP-,2020-04-29,1588181192.0,1,I originally started playing in 2014 on an ipad I took a break and at around 9 I switched to a laptop. in my opinion start with mobile.,foyxuie,N/A
https://www.reddit.com/r/RobloxParents/comments/g9lc6n/is_mobile_or_desktop_better_to_introduce_child_to/,Blaziers,2020-05-17,1589741275.0,1,"Desktop, soon your child will want to be able to play on a desktop (mobile has some limitations) and you’d want them used to it, at least a little. Personally, my friend played on her phone for years, and now, she can’t quite play ROBLOX well on a PC.",fqy1y9i,N/A
https://www.reddit.com/r/RobloxParents/comments/g9l987/is_roblox_ok_for_a_5_year_old/,DiscustingDegenerate,2020-04-28,1588076104.0,2,if you disable chat and put age restrictions it's fine but if you don't it's very possible he'll find some weird things,fou4oek,N/A
https://www.reddit.com/r/RobloxParents/comments/g9l987/is_roblox_ok_for_a_5_year_old/,FPMFP-,2020-04-29,1588181268.0,1,Roblox can be very questionable for kids in my opinion most of the popular games have some violence.. maybe a bit more ;),foyxzot,N/A
https://www.reddit.com/r/RobloxParents/comments/g9l5el/best_age_for_kid_to_start_playing_roblox/,MinimumComfortable,2020-04-28,1588102757.0,2,Around 4-5 I think,fovkar7,N/A
https://www.reddit.com/r/RobloxParents/comments/g9l5el/best_age_for_kid_to_start_playing_roblox/,Cookiesrdelishus,2020-04-29,1588152441.0,1,"This is hard question to answer.  
Roblox is created for kids. So technically, a 6 year old can play it just fine. Most roblox games are created as PG as possible for kids. With the exception of some games like horror games and war games.  


But that doesn't stop teenagers and adults from playing the game. Granted, I'm 18 and I play roblox, been playing since I was 12. but I'm just here to warn you. A lot of older kids and sometimes even adults can get a little rough ingame. They bypass the chat filters to curse and insult other users. I've been roblox for a while and I have seen a lot of inmature players who think its funny to insult people, joke about mental illnesses, and act explicit in a kids game. Not everyone acts like this, but every roblox game has its fair share of toxic players that ruin the fun.  


I would say 11 would be the absolute minimum age someone can play roblox. Even though roblox markets itself as a kids game and is made as a kids game, the older and toxic players ruin it. The game is more PG13 at this point",foxq857,N/A
https://www.reddit.com/r/RobloxParents/comments/g9l5el/best_age_for_kid_to_start_playing_roblox/,scorpycoby,2023-02-01,1675226331.0,1,9,j6ql471,N/A
https://www.reddit.com/r/RobloxParents/comments/g9kyev/roblox_and_covid19_discussion_megathread_discuss/,MinimumComfortable,2020-04-28,1588110513.0,3,"It helps keep my son occupied otherwise not sure what he would have done all day, so it's a blessing!",fovzzfb,N/A
https://www.reddit.com/r/RobloxParents/comments/g9kxgc/how_many_hours_a_day_do_you_let_your_kid_play/,MinimumComfortable,2020-04-28,1588102845.0,1,Too many :),fovkhiy,N/A
https://www.reddit.com/r/RobloxParents/comments/g9kxgc/how_many_hours_a_day_do_you_let_your_kid_play/,Madladlurker,2020-07-29,1596032185.0,1,Like 3,fzmfrgr,N/A
https://www.reddit.com/r/RobloxParents/comments/g9kwua/is_there_a_way_to_connect_a_parents_and_their/,Nullvoidance,2020-04-29,1588166505.0,1,No.,foy6mu1,N/A
https://www.reddit.com/r/RobloxParents/comments/gafp8i/how_do_you_feel_about_letting_your_child_play/,Nullvoidance,2020-05-01,1588303987.0,4,The only time it becomes a problem is if they already have some mental illness.  No violence is caused just from video games if thats what youre wondering.,fp4p40t,N/A
https://www.reddit.com/r/RobloxParents/comments/gafp8i/how_do_you_feel_about_letting_your_child_play/,Blaziers,2020-05-17,1589740628.0,1,No one really plays Murder Mystery 2 for the gameplay. The people who are serious about it use it for trading the in-game items.,fqy0ho4,N/A
https://www.reddit.com/r/RobloxParents/comments/gafp8i/how_do_you_feel_about_letting_your_child_play/,Afimiliarface,2020-07-01,1593626522.0,1,"Murder Mystery 2 is one of my favorite games on roblox.
The murder eliminates the innocents from the game before time runs out.
Innocents survive the murder.
Sheriff has too shoot the murder before they kill everyone.
There is no blood or gore in the game, and my 6 yr old cousin plays it all the time op and nothing happened to him.
However, if your child wants to trade weapons, especially high tier weapons that are worth a lot, learn the values of it because there are people out there that scam people who do not know values.
But if your playing flicker or something like that, I would not really recommend that game to anyone under the age of 10.",fwlujwa,N/A
https://www.reddit.com/r/RobloxParents/comments/ga37a9/big_brother_wants_to_play_minecraft_and_little/,Nullvoidance,2020-04-29,1588165079.0,3,Buy another computer.,foy4gm3,N/A
