url,author,date,timestamp,score,comment,comment_id,parent_id
https://www.reddit.com/r/RobloxParents/comments/md53fi/inadequate_parental_controls/,dianndianna,2021-05-06,1620311197.0,4,"I agree. I have been frustrated since downloading Roblox for my son, who is almost 9, a few months ago. I would like to be able to block games, block content from other countries (just due to less monitoring), or even make my own “curated list” of games that I think are okay for him. And games shouldn’t be shown if they aren’t allowed... when I turn on account restrictions, he basically struggles to find much of anything to play and gets upset going from game to game only to find it won’t let him play. 

They really cater to kids and seem to be very driven by kids playing on the platform.  I wish they would take parental control settings seriously.",gx5jdbv,N/A
https://www.reddit.com/r/RobloxParents/comments/md53fi/inadequate_parental_controls/,cutenfuzzie,2021-05-06,1620337227.0,3,I also agree. I am regretting ever letting my child use Roblox.,gx79ppg,N/A
https://i.redd.it/wahei45uohz41.jpg,Deathly_banana,2020-06-11,1591900446.0,3,Hehehe secy,ftq05wx,N/A
https://i.redd.it/wahei45uohz41.jpg,Afimiliarface,2020-07-01,1593625803.0,2,"I want to report this too what’s the game called




heheh",fwlsxns,N/A
https://i.redd.it/wahei45uohz41.jpg,StupidSam1,2020-05-29,1590754416.0,1,"Report it, these games are from around 2014 and were botted. But didn't get deleted by Roblox. How did your kid even find this?",fs6xz8e,N/A
https://i.redd.it/wahei45uohz41.jpg,Bad_Time_Trio,2020-06-10,1591774211.0,1,I thought they removed those games now... report it and hope roblox sees it,ftkb693,N/A
https://i.redd.it/wahei45uohz41.jpg,Mixie_nothere18,2022-08-14,1660458986.0,2,Same,ik83wq9,fwlsxns
https://i.redd.it/wahei45uohz41.jpg,BilledSauce,2020-05-30,1590864985.0,1,If you know it i know it,fsc5845,fs6xz8e
https://i.redd.it/wahei45uohz41.jpg,BilledSauce,2020-06-10,1591774271.0,3,"They did nothing.
Maybe its cause i vacinate my kids that they play this",ftkb8lc,ftkb693
https://i.redd.it/wahei45uohz41.jpg,StupidSam1,2020-05-30,1590865969.0,2,?,fsc81iq,fsc5845
https://i.redd.it/wahei45uohz41.jpg,evanultra01,2020-06-21,1592717461.0,1,karen,fvih6mv,ftkb8lc
https://i.redd.it/wahei45uohz41.jpg,BilledSauce,2020-05-30,1590865999.0,2,I dont know how he came to the game,fsc84hl,fsc81iq
https://i.redd.it/wahei45uohz41.jpg,BilledSauce,2020-06-21,1592719751.0,3,This was Just a troll to see how this SR would react,fvijxpg,fvih6mv
https://i.redd.it/wahei45uohz41.jpg,StupidSam1,2020-05-30,1590866028.0,1,clickbaited games?,fsc87my,fsc84hl
https://i.redd.it/wahei45uohz41.jpg,evanultra01,2020-06-23,1592944725.0,1,"Oh okay

There should have been /s at the end of that message",fvs4uqh,fvijxpg
https://i.redd.it/wahei45uohz41.jpg,BilledSauce,2020-05-30,1590866774.0,2,Could be,fscaag7,fsc87my
https://www.reddit.com/r/RobloxParents/comments/rofave/filter_curated_content/,treliss,2021-12-29,1640812400.0,5,"I don't get why Roblox is so popular with elementary school children when the parental controls are grossly inadequate.

I tried account restrictions, but every game it recommends my son is restricted. It's too frustrating for him to click on game after game after game that was restricted.

When I saw a lot of the games it was recommending my 8-year-old, there is no way I would let him play without account restrictions (Squid Games, horror movies, etc.).

1) Roblox needs to only show games that can be played in recommendations and search when in curated mode. Or at a minimum only recommend games that can be played and in search clearly put an X and gray out the ones that are blocked.

2) Have an option to curate games, but allow chat with parent-approved friends.

3) Have an option to allow list and deny list additional games beyond what the account.

My ideal parental controls is that my child is only shown the games he is able to play, that are on the curated list, or approved by me. My ideal chat option is that my child can only chat with friends and that I control the friends list.

With the current account restrictions, my son was so frustrated with everything being blocked he uninstalled the game. He's tried talking me into allowing him to play without account restrictions, but there are inadequate parental controls without account restrictions and I have said no.",hqgk51b,N/A
https://www.reddit.com/r/RobloxParents/comments/rofave/filter_curated_content/,BZNESS,2021-12-26,1640488683.0,3,"Having this problem also. Just downloaded for my son, but every game I try says restricted",hpzilen,N/A
https://www.reddit.com/r/RobloxParents/comments/rofave/filter_curated_content/,PropadataFilms,2021-12-28,1640715143.0,1,Right?! I just started with my kid as well and confused by this - following.,hqazr60,N/A
https://www.reddit.com/r/RobloxParents/comments/n6igc9/account_restrictions/,Mediocre_at_best_321,2022-01-09,1641744508.0,2,That's two more than I've found so far!  Getting ready to uninstall and move on.,hrxewc2,N/A
https://www.reddit.com/r/RobloxParents/comments/j1vzc5/can_i_create_my_own_game_list/,BrandonIT,2020-09-30,1601431701.0,5,"No.  The Parental Controls are really a joke.  There's no way to do any of that, not even to see what games are parental controls.",g74qokg,N/A
https://www.reddit.com/r/RobloxParents/comments/s8mb2i/what_is_the_most_educational_game_on_roblox_in/,scorpycoby,2023-02-01,1675225456.0,1,"jenga
That's how bad the platform is now😭😭",j6qjgxz,N/A
https://v.redd.it/5ny9tyu72i971,mariommsfilho,2021-08-29,1630197812.0,2,Roblox Can be fired moderators Due to parents complain About childrens playing weird games.,haqy8l0,N/A
https://v.redd.it/5ny9tyu72i971,KrishRB,2021-07-21,1626843171.0,1,"Report the game also, I don't think pole dancing without stripping is bad? Also respectfully saying why ur son playing these kind of games lol.",h5ysqmv,N/A
https://v.redd.it/5ny9tyu72i971,mikaosias,2021-07-22,1626926912.0,1,It was my daughter who was playing and I usually play with her the game has since been taken down I just didn’t image such a game on such a nice platform as roblox,h638v2f,h5ysqmv
https://v.redd.it/5ny9tyu72i971,KrishRB,2021-07-22,1626927235.0,2,"Such games do exist for a short while and you are actually lucky, there are games which are hidden rlly well with actual nudity and such, just ask your daughter to play the popular games and not wander off because roblox moderation has gotten bad lately",h639dy3,h638v2f
https://www.reddit.com/r/RobloxParents/comments/lk7kjn/whats_with_all_the_get_eaten_games/,zackyattacky,2021-02-16,1613433932.0,1,"Get Eaten games have always been around as far as I can remember. I joined Roblox in 2009 and I remember playing them back then. They used to be more normal though. Get Eaten by a Giant Noob was one I remember and it was just a big blocky character and funny to die in stomach acid or go through the digestive tract. All these games probably stem from back then. Eventually people started using cartoon characters to draw attention and I guess now they're using real people. Using famous people is for click bait. I haven't played get eaten games in years and they might be fetish stuff now but I honestly don't think that was the original intention from the way older games.  


Also just checked out Snow Giantess RP and the first thing I saw was a furry putting people in his stomach. That's just straight up fetish stuff. Extremely weird.",gnl9po4,N/A
https://www.reddit.com/r/RobloxParents/comments/hzjl5c/searching_for_parental_controlsapproved_games/,TheStrangeView,2020-09-01,1598972585.0,1,"Maybe instead of ""Parental Controls""

You should check out this other rating system called the [ESRB](https://www.esrb.org/ratings-guide/) (Entertainment Service Rating Board) and this [PEGI](https://pegi.info/what-do-the-labels-mean) (Pan European Game Information)


I would also recommend you PLAY titles you child shows interest in to better inform you of what they are experiencing.",g3lh61p,N/A
https://www.reddit.com/r/RobloxParents/comments/hzjl5c/searching_for_parental_controlsapproved_games/,BrandonIT,2020-09-01,1598978353.0,2,You're not worth replying to.  Take your downvote and buzz off.,g3lwp2w,g3lh61p
https://www.reddit.com/r/RobloxParents/comments/hzjl5c/searching_for_parental_controlsapproved_games/,scorpycoby,2023-02-01,1675225861.0,1,You make me want to die internally,j6qk8go,g3lh61p
https://www.reddit.com/r/RobloxParents/comments/hzjl5c/searching_for_parental_controlsapproved_games/,Mediocre_at_best_321,2022-01-09,1641745604.0,2,Agreed.  That guy is either an idiot or one of the predators taking advantage of this pedo buffet.,hrxhrpc,g3lwp2w
https://www.reddit.com/r/RobloxParents/comments/hzjl5c/searching_for_parental_controlsapproved_games/,TheStrangeView,2020-09-01,1598979011.0,2,Do your homework.,g3lym5m,g3lwp2w
https://www.youtube.com/watch?v=qqFHKEWQ90g&t=5m20s,JollyMingtingTDM,2020-05-14,1589454296.0,14,Sadly roblox or the developer wont do anything as it is because your kid accepted the trade so it is more her fault then theirs and teach here commonsense,fqlcw9p,N/A
https://www.youtube.com/watch?v=qqFHKEWQ90g&t=5m20s,MurderMysteryTrades,2020-05-14,1589458097.0,8,I dont think they will do anything because shes the 1 who accepted the trade. U should teach her not to do this stuff,fqlhbd2,N/A
https://www.youtube.com/watch?v=qqFHKEWQ90g&t=5m20s,TheCoder190,2020-05-14,1589465314.0,6,"I feel bad, scammers should not exist but sadly, she accepted the trade so they really can't do anything, some tips to not get scammed is, don't fall for ""i'll borrow it"" or ""give me it and i'll give you my inv"", sorry to hear about this, I guess, keep trying to get a godly..???? (seer isn't that good but still a scam btw)",fqlsnez,N/A
https://www.youtube.com/watch?v=qqFHKEWQ90g&t=5m20s,suckmymilk_IsMyDad,2020-05-14,1589466427.0,4,Your fault,fqluq2k,N/A
https://www.reddit.com/r/RobloxParents/comments/ge8qsi/the_roblox_chat_had_helped_my_kid_with_grammar/,JollyMingtingTDM,2020-05-07,1588850816.0,3,Great to hear,fprd7xq,N/A
https://www.reddit.com/r/RobloxParents/comments/ge8qsi/the_roblox_chat_had_helped_my_kid_with_grammar/,Blaziers,2020-05-17,1589738691.0,2,That is probably the cutest thing I’ve heard all day!,fqxvy81,N/A
https://www.reddit.com/r/RobloxParents/comments/lm1nl9/poisonous_beast_mode_face_value/,Zachary_-taylor,2021-08-08,1628426573.0,2,I have the poisonous beast mode face i think it's worth it i get asked all the time how did u get that My roblox acount name Flamespeed production,h85wmh3,N/A
https://www.reddit.com/r/RobloxParents/comments/lm1nl9/poisonous_beast_mode_face_value/,OTtotie,2023-01-03,1672788389.0,2,i would say in the hundred thousands or maybe millions it was out for 24 hours imgne strolling across it having ten robux to buy it and wanting to buy it imagne the odds,j2u41ls,N/A
https://www.reddit.com/r/RobloxParents/comments/lm1nl9/poisonous_beast_mode_face_value/,zackyattacky,2021-02-18,1613617801.0,1,"[Poisonous Beast Mode](https://www.roblox.com/catalog/2606177838/Poisonous-Beast-Mode) is not a limited item so it can't be traded or sold. There's 3 other beast modes faces that are limited items. [Blizzard Beast Mode](https://www.roblox.com/catalog/209995252/Blizzard-Beast-Mode), [Radioactive Beast Mode](https://www.roblox.com/catalog/2225761296/Radioactive-Beast-Mode), and [Beast Mode](https://www.roblox.com/catalog/128992838/Beast-Mode). They cost much more than 15k though.",gnuepeq,N/A
https://www.reddit.com/r/RobloxParents/comments/lm1nl9/poisonous_beast_mode_face_value/,Spare_Ad8932,2021-03-12,1615522640.0,1,Yes!!,gqnmpuo,N/A
https://www.reddit.com/r/RobloxParents/comments/lm1nl9/poisonous_beast_mode_face_value/,MattDartReal,2022-04-08,1649442754.0,1,"If it's not a limited item, and you cant trade it, then I would say it's worth 10 Robux, because it cost 10 Robux!",i3xnct1,N/A
https://www.reddit.com/r/RobloxParents/comments/lm1nl9/poisonous_beast_mode_face_value/,AggressiveAmbition55,2023-01-05,1672943542.0,2,"wrong, its not worth anything and its not tradeable",j33070f,j2u41ls
https://www.reddit.com/r/RobloxParents/comments/lm1nl9/poisonous_beast_mode_face_value/,dollzxoxo,2022-04-11,1649688004.0,2,"Most limiteds started off as 10 to 100 robux back then, it would be worth more than that if it ever goes limited like 40k i'd say.",i4as6dg,i3xnct1
https://www.reddit.com/r/RobloxParents/comments/lm1nl9/poisonous_beast_mode_face_value/,IoIZambie,2023-01-30,1675091575.0,1,🤓☝,j6iaehv,j33070f
https://www.reddit.com/r/RobloxParents/comments/lm1nl9/poisonous_beast_mode_face_value/,Hot_Necessary3357,2022-05-16,1652703620.0,2,"Too many people own it, it won’t go over over 12k",i8t7qpe,i4as6dg
https://www.reddit.com/r/RobloxParents/comments/gb8lyu/anybody_elses_kids_love_watching_roblox_gameplay/,cgb33,2020-05-03,1588517217.0,1,"All. The. Time. 
New rule in our house - no gaming also includes gaming YouTube videos.",fpd0k90,N/A
https://www.reddit.com/r/RobloxParents/comments/gb8lyu/anybody_elses_kids_love_watching_roblox_gameplay/,quanchino,2020-05-04,1588608300.0,1,"
Before you can log in to Game Jolt, you need to verify the email address on your account.

We've sent you an email with instructions on how to authorize your account.

If you don't see an email within 10 minutes, please check your spam folder. It might have gobbled it up.

Note that you have a week to authorize your account. After that, it will be deleted and you'll have to sign up again.",fpgrq8r,N/A
https://www.reddit.com/r/RobloxParents/comments/gajpk2/hey_everybody_my_little_one_just_started_playing/,evanultra01,2020-06-21,1592717944.0,1,"Never let them play any games called ""scented con"", they are pure porn games with interactive sex features.

You can disable them from playing these by going here on a PC

[https://web.roblox.com/my/account#!/security](https://web.roblox.com/my/account#!/security)

Click the account restrictions and account button to ON, the pin makes it so they cant disable it.

It will also prevent them from reading in-game chats, which is a good thing as people can ""bypass"" the filter like the b in bitch with a 9 so 9itch

You can control these contact settings here. 

[https://web.roblox.com/my/account#!/privacy](https://web.roblox.com/my/account#!/privacy)",fvihs5q,N/A
https://www.reddit.com/r/RobloxParents/comments/g9whbe/the_covid_19_quarantine_must_be_increasing/,scorpycoby,2023-02-01,1675226239.0,1,This is why I don't buy robux,j6qkxuo,N/A
https://www.reddit.com/r/RobloxParents/comments/tgp73r/a_potential_solution_to_lack_of_parental_controls/,derfad,2022-08-18,1660846472.0,1,could be a good idea,iktrcs1,N/A
https://www.reddit.com/r/RobloxParents/comments/tgp73r/a_potential_solution_to_lack_of_parental_controls/,ksangeleyes5683,2022-11-04,1667530108.0,1,After what just happened with my child I agree.  I have called crimes against kids last night and today so scary,iuzaqfd,N/A
https://www.reddit.com/r/RobloxParents/comments/t7be4z/is_there_a_way_to_create_a_avatar_as_a_parent_and/,scorpycoby,2022-04-30,1651332801.0,1,make a new account on your device then go to her profile and add her as a friend,i6ssmwj,N/A
https://www.polygon.com/2020/4/16/21201443/coronavirus-self-isolation-quarantine-life-events-birthday-parties-roblox-weddings-world-of-warcraft,StupidSam1,2020-05-29,1590754578.0,1,"When the kid asked for a Lego themed birthday party, and they get an online roblox birthday.",fs6y73s,N/A
https://www.reddit.com/r/RobloxParents/comments/gfdvc5/recommendations_for_birthday_party/,zackyattacky,2020-05-08,1588901960.0,3,"Epic Minigames  
Murder Mystery 2  
Hide and Seek Extreme  
Natural Disaster Survival  
Survive the Disasters 2  
Cursed Islands  
Icebreaker  
Super Bomb Survival  
Dodgeball  
Lab Experiment",fpu0bzn,N/A
https://www.reddit.com/r/RobloxParents/comments/gfdvc5/recommendations_for_birthday_party/,sloth_samurai,2020-05-07,1588886729.0,3,"I'd say maybe Epic Minigames, maybe a survive the disaster game",fpt8ik1,N/A
https://www.reddit.com/r/RobloxParents/comments/gfdvc5/recommendations_for_birthday_party/,MinimumComfortable,2020-05-08,1588914649.0,3,"Big paintball

Epic minigames

Hide and seek extreme

Simon says",fpujnj0,N/A
https://www.reddit.com/r/RobloxParents/comments/geghsw/for_parents_who_are_struggling_to_keep_their/,MinimumComfortable,2020-05-06,1588756022.0,1,"Great advice

You should post this on /r/parents and /r/roblox",fpnajlk,N/A
https://www.reddit.com/r/RobloxParents/comments/geghsw/for_parents_who_are_struggling_to_keep_their/,xornotxor,2020-08-23,1598194153.0,1,"Careful what you wish for . Roblox is not the type of nanny you are looking for.  The amount of dopamine this game generates is off the charts. I understand you would want scientific evidence but this is where your parenting common sense should kick in.  However, if you can somehow limit the activity , then yes this is a good “distraction”.",g2l6xjo,N/A
https://www.reddit.com/r/RobloxParents/comments/ged7ku/i_thought_roblox_was_free_but_turns_out_its_the/,StupidSam1,2020-05-08,1588941658.0,8,"u/JollyMingtingTDM is correct, but really you don't need robux to play. You can have tons of fun without robux.",fpvcmd0,N/A
https://www.reddit.com/r/RobloxParents/comments/ged7ku/i_thought_roblox_was_free_but_turns_out_its_the/,JollyMingtingTDM,2020-05-07,1588850800.0,4,Well it is free but with robux you can customize your avatar and play exclusive games,fprd7aj,N/A
https://www.reddit.com/r/RobloxParents/comments/ged7ku/i_thought_roblox_was_free_but_turns_out_its_the/,Blaziers,2020-05-17,1589738645.0,2,"You don’t need Robux to play, I only spend Robux on my avatar, not on games, and I have tons of fun.",fqxvu9w,N/A
https://www.reddit.com/r/RobloxParents/comments/ged7ku/i_thought_roblox_was_free_but_turns_out_its_the/,Afimiliarface,2020-07-01,1593626225.0,1,"Yes it roblox is really a to win but you don’t need to pay to have fun.
If your child would like to customize their avatar, roblox promo codes come out every few weeks or so watch out for those.
There is also plenty of free items in the catalog, like the silly fun face, chill face, a medieval hood, country fedoras and much more",fwltvcg,N/A
https://www.reddit.com/r/RobloxParents/comments/ged7ku/i_thought_roblox_was_free_but_turns_out_its_the/,AndyIsAnIdiot,2020-07-19,1595172400.0,1,"Yes roblox is indeed a free-to-play platform (f2p) but not all the games/items/clothing is , actually 99.9% of the clothing/hats/accessories you can only get by paying irl money, your kid can get a decent looking avatar for under 400 robux tho (around 5$) , on the other hand 99% of the games are free to play (not including the gamepasses which give the player an in-game advantage )

If your son ever wants to get into trading limited items that might be pricy, some items costing hundreds if not thousands of dollars, plus all the trading notions ( Rap, value, trend, demand, available/premium copies, Number/percentage of hoarded items of that kind, upgrading & downgrading items plus all the charts seeing how the item evolved over years and if it had some massive drops or if the item is projected)",fykcynj,N/A
https://www.reddit.com/r/RobloxParents/comments/ged7ku/i_thought_roblox_was_free_but_turns_out_its_the/,JollyMingtingTDM,2020-05-08,1588946324.0,3,Yes,fpvjzi5,fpvcmd0
https://www.reddit.com/r/RobloxParents/comments/ged7ku/i_thought_roblox_was_free_but_turns_out_its_the/,scorpycoby,2023-02-01,1675226042.0,1,"...And they say ""free"" to lure in the parents and then make them get fæking robux🙄",j6qkkgx,fpvcmd0
https://www.reddit.com/r/RobloxParents/comments/ged7ku/i_thought_roblox_was_free_but_turns_out_its_the/,StupidSam1,2023-02-01,1675264637.0,2,welcome to capitalism,j6s9gb9,j6qkkgx
https://www.reddit.com/r/RobloxParents/comments/ged7ku/i_thought_roblox_was_free_but_turns_out_its_the/,scorpycoby,2023-02-02,1675306511.0,1,I guess we're stuck knee deep in this Roblox capitalism crap,j6v865t,j6s9gb9
https://www.reddit.com/r/RobloxParents/comments/gdlb8s/my_6yr_old_is_asking_me_for_robux_whats_the_go/,Blaziers,2020-05-17,1589739411.0,3,A 6 year old isn’t quite old enough to be able to responsibly use Robux or ROBLOX Premium. I suggest to start doing it when they’re older. Hope this helps!,fqxxn50,N/A
https://www.reddit.com/r/RobloxParents/comments/gdlb8s/my_6yr_old_is_asking_me_for_robux_whats_the_go/,zackyattacky,2020-05-04,1588635986.0,3,"I'm going to use the cheapest options for Premium and Robux as examples. Going to be using USD prices to but I'm sure it's similar. 

The cheapest option for buying Robux is $4.99 and you get 400 Robux. The cheapest option for Premium is also $4.99 and you get 450 Robux. You will get more Robux with Premium but Premium membership can only be bought once a month. If you want to get more Robux after buying Premium you will have to buy the Robux directly or wait til next month for the membership to renew. If you already have Premium membership and go to buy Robux, you will get a 10% bonus with the purchase. With Premium, buying the $4.99 Robux option will get you 440 Robux instead of 400. 

Premium membership comes with some features a 6 year old won't use and may not even be aware of. There's hats for your avatar that are considered limited and can be traded with Premium, I doubt he will be trading hats. Premium also lets you upload shirts and pants for your avatar. At 6 I don't think he'll be doing that either. What Premium is good for is having a set date that your kid will get his Robux. If you allow the Premium membership to renew each month,there will be a set date your kid can look forward too that they will get his Robux. Might be nice to have it marked on a calendar, and have your kid understand their spending limit. Or you can buy them Robux when you feel they have earned it and that's perfectly alright too. Going to want to figure out how much Robux you're willing to spend though, 450 Robux may not go very far depending on what your kid buys or it can be exactly what they need.

I would talk to your kid and figure out exactly what they want it for and see if there's anything in mind he wants to buy. There's different things to spend Robux on. Robux can be spent on hats for your avatar and game passes for specific games. Hats and game passes will last forever on your account. There are some purchases inside Roblox games that aren't permanent though, would recommend making sure you stray away from buying those. Roblox also doesn't set the prices of everything, the game creators do. It's always good to know what you're buying and seeing if the benefit of having it outweighs the cost. There's also no point in buying game passes for a game your kid will only play for a day, get game passes in a game you know they play often. Robux can be thrown away really easy so you might want to monitor purchases.

This is a lot longer than intended but there's a lot of different parts to Roblox parents and even kids may not understand when it comes to purchases. If you have any more questions about anything on Roblox feel free to ask.",fpi8uzn,N/A
https://www.reddit.com/r/RobloxParents/comments/gcz6bh/is_there_a_page_that_tells_you_what_items_your/,Seen220,2020-05-04,1588552410.0,4,"Yes there is! On the top right corner press the Robux symbol, then click on the bar that states how much robux you have. This will show you your transaction history.

(If you need more responces, repost this on r/RobloxR)",fpepvnx,N/A
https://www.reddit.com/r/RobloxParents/comments/gcz6bh/is_there_a_page_that_tells_you_what_items_your/,zackyattacky,2020-05-04,1588636638.0,3,"Click on your Robux on the top right of the website. It will have a little drop down that says how much Robux you have and a buy more button. Click on the Robux amount. It will bring you to a page that shows you how much Robux your account got in the past day. On that page there will be 3 tabs, click the ""My Transactions"" tab and you can see all the purchases on the account.

If you have trouble finding it here's a link to the page [here](https://www.roblox.com/My/Money.aspx#/#MyTransactions_tab).",fpi9znt,N/A
https://www.reddit.com/r/RobloxParents/comments/gcz6bh/is_there_a_page_that_tells_you_what_items_your/,MinimumComfortable,2020-05-04,1588566237.0,3,When I click on Robux symbol all I get is that it tells me the balance and an option to buy more Robux? Can't find transaction history,fpfb4cr,fpepvnx
https://www.reddit.com/r/RobloxParents/comments/gcz6bh/is_there_a_page_that_tells_you_what_items_your/,Seen220,2020-05-04,1588569562.0,3,"try this

 [https://www.roblox.com/My/Money.aspx#/#MyTransactions\_tab](https://www.roblox.com/My/Money.aspx#/#MyTransactions_tab) 

 [https://www.roblox.com/My/Money.aspx#/#MyTransactions\_tab](https://www.roblox.com/My/Money.aspx#/#MyTransactions_tab)",fpffb41,fpfb4cr
https://www.reddit.com/r/RobloxParents/comments/gcz6bh/is_there_a_page_that_tells_you_what_items_your/,MinimumComfortable,2020-05-05,1588721629.0,3,Thanks it worked on computer. Apparently on mobile app you cannot,fplxye3,fpffb41
https://www.reddit.com/r/RobloxParents/comments/g9x9pe/am_happy_to_be_a_new_member_of_the_roblox_parent/,FPMFP-,2020-04-29,1588180891.0,2,Im not a parent I just like being here :),foyx9rc,N/A
https://www.reddit.com/r/RobloxParents/comments/g9x9pe/am_happy_to_be_a_new_member_of_the_roblox_parent/,MinimumComfortable,2020-04-28,1588114035.0,1,Welcome to the community! all of us here are parents with kids playing and we will be happy to help with any questions! The community here is very helpful!,fow6q5y,N/A
https://www.reddit.com/r/RobloxParents/comments/g9x9pe/am_happy_to_be_a_new_member_of_the_roblox_parent/,0_Dancing_Llama_0,2020-04-29,1588204555.0,2,Same :),fp08o1i,foyx9rc
https://www.reddit.com/r/RobloxParents/comments/g9u1bu/my_son_loves_the_roblox_oof_and_the_nom_nom_nom/,0_Dancing_Llama_0,2020-04-29,1588204587.0,1,Awh,fp08q4x,N/A
